{
  "verdict": "pass",
  "largest_remaining_gap": "",
  "severity": "none",
  "evidence": [
    "make automation-check PASSED (Exit 0, 37/37 tests OK)",
    "make syntax-check PASSED (Exit 0)",
    "make test PASSED (Exit 0, 148 tests run: 147 OK, 1 skipped)",
    "make test-security PASSED (Exit 0, 41/41 tests OK)",
    "make lint PASSED (Exit 0, ruff check clean, ty exit-zero)",
    "git diff --check PASSED (Exit 0)",
    "All 14 new deterministic unit tests in tests/test_e2e_live_fixes.py pass cleanly without live network calls",
    "Scope respected: 6 files modified/created within allowed_paths (.github/workflows/daily-run.yml, scripts/provision_account_secrets.py, sdk/client.py, run.py, tests/test_e2e_live_fixes.py, automation/gauntlet/workbench.md) vs budget max_files_changed: 10",
    "No real credentials or live Pixel Starships traffic used during automated validation",
    "All 12 Quality Bar criteria satisfied with zero unresolved defects"
  ],
  "quality_bar_failures": [],
  "required_next_action": ""
}
