{
  "verdict": "pass",
  "largest_remaining_gap": "",
  "severity": "none",
  "evidence": [
    "Validation commands make automation-check, make syntax-check, make test (105 tests), make test-security (41 tests), make lint, and git diff --check all pass cleanly with exit code 0.",
    "Dependency contract verified: GHA workflow installs requirements.txt; missing dependency test verifies ratelimit absence handling.",
    "Account configuration contract verified: 0 accounts safe exit 0, 1 account, 5 accounts independent loop, partial accounts fast fail before network.",
    "Token and output safety verified: zero secrets/tokens exposed in stdout, stderr, logs, or exceptions; dynamic secret redaction verified.",
    "Idempotency verified: test_idempotency_repeated_execution confirms repeated execution safety."
  ],
  "quality_bar_failures": [],
  "required_next_action": ""
}
